id_gov,id_google,name,user_ratings_total,rating,reviews.author_name,reviews.rating,reviews.text,reviews.profile_photo_url
21b31ac0-0086-49e2-868d-7c4ea9aaff49,ChIJ5fJd2rFdFkcRfOI0Uzojdjw,Hotel Junior,777,4.1,Aiden Gage,1,"While on a tour through central Europe we stopped at this hotel, as I'm going to bed I find bed bugs in the beds and up the walls. Having bed bugs wasn't just confined to our room, but our tour directors who help organize it, kept waking up through the night because they thought they felt biting. We also got blamed for bringing them from Prague, which wasn't the case. There's also no air conditioning.

The good stuff we expirienced, was that we ended up getting a new room that was bigger and that actually had a shower door. Wifi was actually free unlike any of that bs you get in the US.",https://lh3.googleusercontent.com/a-/ALV-UjW1BUU5t1F8iOLGlojkaJR3rA8LzpNMDdtuXI0Dczrge833eVEqbw=s128-c0x00000000-cc-rp-mo
fc05f09a-f659-43b4-9594-eff72802ae6f,ChIJVwOQVRtbFkcRJ3_JAilQjuo,Ibis,NA,NA,NA,NA,NA,NA
7b6431de-978b-4aa4-92c0-65c5afa1b544,NA,NA,NA,NA,NA,NA,NA,NA
2d6688c8-8e0e-4158-8d18-7cd020d34600,NA,NA,NA,NA,NA,NA,NA,NA
fb61b1ef-d6a4-4f17-8100-cb3814ff8908,ChIJgzowjWlbFkcRjaajc9A8CK4,Krakowska 30,NA,NA,NA,NA,NA,NA
641e0c6a-2a06-4960-b320-c4910a9b2111,ChIJzYzSegtbFkcRn8Az_SUWL68,Nobilton Hotel,437,4.1,Iryna Yakymets,5,"The hotel is located right near the city center. The room was small but very clean and nice. No AC, but the room had a fan, which was enough for the size. Beautiful balcony with view on the lovely courtyard. Friendly staff.",https://lh3.googleusercontent.com/a-/ALV-UjWwpDlrJubBGDKymDhyqtqHz4PNjMaCZoGb4w6GFYYrG-_AkygWcQ=s128-c0x00000000-cc-rp-mo-ba3
641e0c6a-2a06-4960-b320-c4910a9b2111,ChIJzYzSegtbFkcRn8Az_SUWL68,Nobilton Hotel,437,4.1,Stuart Nicholson,5,I loved it here the food was brilliant and the rooms were spotless the staff were so friendly and the location is great me and my mum and dad will be coming back here because it is awsome,https://lh3.googleusercontent.com/a-/ALV-UjX2NS4ckaFP2Z7W_x60ErRBZK4DtxZ5PKBWpJA620HGO3Nn6I2LoA=s128-c0x00000000-cc-rp-mo-ba3
641e0c6a-2a06-4960-b320-c4910a9b2111,ChIJzYzSegtbFkcRn8Az_SUWL68,Nobilton Hotel,437,4.1,Anna Sokolova,1,"Let's start with the fact that the room I was checked into seemed not only outdated, but also not clean enough. The towels looked like they hadn't been washed in years and there were marks in the bathroom from previous guests.

The service in the restaurant also left much to be desired. The waiters were unresponsive and extremely slow. The ordered dishes did not appear on the table for a long time, and when they were finally served, they left much to be desired in quality. I'm sorry, but for these prices I expect something more sophisticated.

The hotel's internet connection was also a frequent source of frustration. The speed was terribly slow and the connection dropped out frequently. This made my stay here even more inconvenient given that I was on a business trip and dependent on network access.",https://lh3.googleusercontent.com/a/ACg8ocJrRrL2ENs_v8qYGCNi4V1-JocNU4YkBE8ECW--ayosXdkh3A=s128-c0x00000000-cc-rp-mo
641e0c6a-2a06-4960-b320-c4910a9b2111,ChIJzYzSegtbFkcRn8Az_SUWL68,Nobilton Hotel,437,4.1,Margaret Fibiger,1,"The only advantage is that it’s close to the old town. Room smells like a restaurant, as the hotel is located above the restaurant. If you close the window there is no fresh air to breathe and when you open it - the street is so busy (even during the night) that it’s impossible to sleep. Another disadvantage that sleep is not possible. After sleeping literally less than 2 hours I wasn’t able to fall asleep because of the noise. Bed - very uncomfortable. Room small and not spacious at all. Summing up - if you don’t mind smelly room definitely you can stay here but they should write that below the hotel is a restaurant and it’s literally next to the busy street. Definitely not coming back to this hotel.",https://lh3.googleusercontent.com/a-/ALV-UjXF9VgeoVpwSpSjNPwda-v4Slzue6w0BtHHcOEg_0fEwKtOacC-=s128-c0x00000000-cc-rp-mo
641e0c6a-2a06-4960-b320-c4910a9b2111,ChIJzYzSegtbFkcRn8Az_SUWL68,Nobilton Hotel,437,4.1,Akira Aokawa,5,"I wanted to rate for 4.5 but that is not possible.
I liked: The hotel is close to the city center. The price was OK compared to other hotels with similar location. The workers were kind and helpful, and they were speaking also English. The breakfast was delicious, even a few types of fruits were available most day. You could also get warm breakfast by choosing from two types of eggs and sausages. Water, tea or coffee placed in the room could be consumed for free. The liquid hand soap had nice smell. The cleaning of the room was scheduled well not to disturb the guest.
I didn't like: The breakfast is only from 7, so you may not be able to eat if you plan to go to other city that day. The food selection is small, which can be a problem if you stay longer. Some people were shutting the door loudly in the night. It would be worth thinking about doors/ locks closing more quietly. On the other hand, the TV turned off itself around 23:15 even if you watched it very quiet. Although the room was not small, due to the layout it was hard to place things somewhere from the suitcase or pack. It would be worth to reconsider the layout leaving place for the guests belongings.
The internet was mostly OK but sometimes weak.",https://lh3.googleusercontent.com/a/ACg8ocIPvz2eBlLCtYiWF36toPvXBaFUUM-5TUPgmNLWreolTY54Fg=s128-c0x00000000-cc-rp-mo
c4ae9a5c-777d-41ba-afc5-23d230c84e83,ChIJ8Y1EqURFFkcRqi4Qy2Lsxgo,ŚWIT Hotel,103,4.6,Marta Podgórska,5,I really recommend!,https://lh3.googleusercontent.com/a/ACg8ocI5njj04RT70zeTBunG2wWobXZxOv_0AVNDrZwefelaBfa69A=s128-c0x00000000-cc-rp-mo
c4ae9a5c-777d-41ba-afc5-23d230c84e83,ChIJ8Y1EqURFFkcRqi4Qy2Lsxgo,ŚWIT Hotel,103,4.6,Stendhal Official,2,,https://lh3.googleusercontent.com/a-/ALV-UjVoeRS4TcNUEXConsfdbvajwIXoapiWABOze0OMAPqJbbgVcZsx=s128-c0x00000000-cc-rp-mo
c4ae9a5c-777d-41ba-afc5-23d230c84e83,ChIJ8Y1EqURFFkcRqi4Qy2Lsxgo,ŚWIT Hotel,103,4.6,julia pabjan,5,"Good morning. We organized a wedding reception at this hotel. I definitely recommend it.  Great service and organization. The ladies responded quickly to any request from us and our guests. Fantastic food, tailored to everyone's needs, taking into account all our suggestions and excluding our guests' allergens. We are impressed with the decor in the room. The ladies prepared everything the way we wanted it to look. After dark, the entire room was illuminated by thousands of small lights, which created a unique atmosphere. The room was air-conditioned, so even though it was 30 degrees outside, guests could feel comfortable inside. There is also a large parking lot next to the hotel, so there were no problems with the lack of parking spaces for our guests' cars. Thank you to everyone who helped make our special day so successful ❤️❤️❤️",https://lh3.googleusercontent.com/a-/ALV-UjU596LH0nq0K4N0bhZI6ho_jzHELWq41-3d62YT1krvR5y8dOI=s128-c0x00000000-cc-rp-mo
c4ae9a5c-777d-41ba-afc5-23d230c84e83,ChIJ8Y1EqURFFkcRqi4Qy2Lsxgo,ŚWIT Hotel,103,4.6,Patrycja Wisnicka,5,"Very nice and quiet place :)
The rooms were clean, very large and spacious, the breakfast was delicious and we were surprised by a nice surprise for the children in the morning when they were served Pancake for breakfast :))) with maple sauce and whipped cream ;)
Thank you!!!",https://lh3.googleusercontent.com/a/ACg8ocJhPoLIwJyQMDvj2E7GtuJLPBfbo-oRoi4vOMaTorh2ZHCLew=s128-c0x00000000-cc-rp-mo-ba3
c4ae9a5c-777d-41ba-afc5-23d230c84e83,ChIJ8Y1EqURFFkcRqi4Qy2Lsxgo,ŚWIT Hotel,103,4.6,Adrian Dorobek,3,"Generally, everything was fine until breakfast, so we do not recommend breakfast, best regards",https://lh3.googleusercontent.com/a/ACg8ocJ9l1iiSC21Q5OvrgTyu7I6yH59ctQF_mj7Kvaw4v51upaNRA=s128-c0x00000000-cc-rp-mo-ba3
04545139-5828-44ab-8e92-b45ec801eeda,ChIJc9nnStdbFkcRHFB9sbG7VRM,Żabka | Prosto z pieca,239,3.2,Niko Fusić,4,"Plenty of choices for booze,food and groceries, nice organisation, they could work a little bit on hospitality inforced to customers.Nice place to buy the things you need, work hours Are accurate.",https://lh3.googleusercontent.com/a/ACg8ocLCfRF0SX61aJyNjtZQH41WzCDdDl-5mFT2BFeh2ImieKc7hA=s128-c0x00000000-cc-rp-mo-ba3
04545139-5828-44ab-8e92-b45ec801eeda,ChIJc9nnStdbFkcRHFB9sbG7VRM,Żabka | Prosto z pieca,239,3.2,Miriama Ivanova,1,"the worst store I've ever been to.
The saleswoman tricked me..
I wanted to buy a few things and she told me that I can't pay with zlotys but only with a card..
so I told her I didn't have the card with me so she made me put the things back on the shelves.
while other people paid with money and not with a card, even my friend paid with money..
but then I let it go because I didn't want to argue with her",https://lh3.googleusercontent.com/a-/ALV-UjWsy3cGjqC7T4OPbtm8FNAqsIU5euYJqmK8G9q3ttZe3HJLXD9r=s128-c0x00000000-cc-rp-mo
04545139-5828-44ab-8e92-b45ec801eeda,ChIJc9nnStdbFkcRHFB9sbG7VRM,Żabka | Prosto z pieca,239,3.2,Kaltham Alassam,1,"If I could give this place no stars at all, I would. The staff is extremely unfriendly to colored-skin foreigners and very rude.",https://lh3.googleusercontent.com/a-/ALV-UjVb62JyLwcAAyvG_YKMwl0-Q3CoACZ9cHjFAT59e8zCi200l9VI=s128-c0x00000000-cc-rp-mo-ba4
04545139-5828-44ab-8e92-b45ec801eeda,ChIJc9nnStdbFkcRHFB9sbG7VRM,Żabka | Prosto z pieca,239,3.2,Queenie Jane,1,"Worst place ever!!!! This place is rude, we are tourist who plan to buy some chocolate but they tricked us to pay more. My friend pay the 12 items double the price!!!! How come they do that with the tourist people. Next time study english language and communicate well. SCAMMER is the girl in the cashier.",https://lh3.googleusercontent.com/a-/ALV-UjWyOayaw7v3tQmYcsyUrrSxLQ2z5jWwEzpNUa2F_A9A5qMJv82S=s128-c0x00000000-cc-rp-mo
04545139-5828-44ab-8e92-b45ec801eeda,ChIJc9nnStdbFkcRHFB9sbG7VRM,Żabka | Prosto z pieca,239,3.2,Juan Brale,1,"The girl at the cashier working in the morning is very, very unfriendly. You cannot have employees like that working with the public.",https://lh3.googleusercontent.com/a-/ALV-UjX2sGLv9xNqkqDavCHzIZfRArLpbaI7aDeE-Y8tCR1Nh3PsTrdJ=s128-c0x00000000-cc-rp-mo-ba3
4fe28f74-ac32-4df0-aa72-7afa0c7224cb,ChIJL0cu5nJbFkcRUnkX1imlzvs,P & J,NA,NA,NA,NA,NA,NA
8c6b78dd-d383-4bc1-8830-2cdf275f389a,NA,NA,NA,NA,NA,NA,NA,NA
793ff34d-b4b0-42cd-b3fb-25810563667d,NA,NA,NA,NA,NA,NA,NA,NA
54219791-6e69-48d5-ac61-037c05b49604,ChIJw2hhVWpbFkcRdriBTOnivEc,Hotel Kazimierz I,1186,4.4,Manu Peñasco,5,"Excellent hotel with a super friendly, polite staff that informs you about the city, restaurants, etc., perfectly. The rooms, restaurant and rest of the hotel, very adequate and clean. Even the smallest detail makes it ideal, such as having a free hot or cold water bottle dispenser in the hallway. Thank you for a fabulous stay at the hotel and in that beautiful city such as Krakow and I threaten to return repeating the hotel.",https://lh3.googleusercontent.com/a-/ALV-UjUt-fDpO74GtJGGSAXXDoTBDZwKxyFPLEFwCMM52ckoVtuIsT50=s128-c0x00000000-cc-rp-mo-ba2
54219791-6e69-48d5-ac61-037c05b49604,ChIJw2hhVWpbFkcRdriBTOnivEc,Hotel Kazimierz I,1186,4.4,Jay Cheek,4,"Great stay, large room, with double and single bed. Location was is OK, 5 minute walk to tram stops and right in the middle of Jewish Quater. Its in a quiet part of town. Staff were friendly.

Room was serviced daily

Bed was a little uncomfortable, and pillows were not the best, so did not get the best nights sleep.

My room was in a seperate building, although not an issue for me, there was no lift.

Overall in terms price paid, it was good stay and I would stay here again.

There is also a fridge in the room",https://lh3.googleusercontent.com/a-/ALV-UjUrRwrSSY9mhVUgLu2yIjjYGftAEB9i9OBaFLSlefAEOjaFHmlu=s128-c0x00000000-cc-rp-mo-ba5
54219791-6e69-48d5-ac61-037c05b49604,ChIJw2hhVWpbFkcRdriBTOnivEc,Hotel Kazimierz I,1186,4.4,Lynda Gill,2,"Not impressed with this hotel. We stayed in the Anex a few yards from the hotel. It is very dated and needs updating.
On arrival with  our 2 friends at 22.00 hours we were given keys to our rooms. Bearing in mind these 2 rooms were booked 6 months in advance, we were on separate floors from our friends.  We asked if we could be on the same floor and were told no by a very surly man on reception.  No reason given.
Our friends took the first floor room which was large and roomy we took the 2nd floor room which was pokey and small with 4 small coat hangers.  We asked to be moved but the surly receptionist said we couldn't until the morning.  We decided to stay in the room as it was only a base to sleep.
We found all the Polish staff at the hotel unfriendly and unhelpful.
The only positive thing about this hotel was the breakfast.  The buffet was amazing with so much choice. This was the reason I gave 2 stars otherwise I'd have only given 1
Would definitely NOT recommend this hotel",https://lh3.googleusercontent.com/a/ACg8ocJq6r6kZDbBl-vI9Emmrmd5U_cVgyujQIEf-xMXATF8U1ICxQ=s128-c0x00000000-cc-rp-mo
54219791-6e69-48d5-ac61-037c05b49604,ChIJw2hhVWpbFkcRdriBTOnivEc,Hotel Kazimierz I,1186,4.4,Mark Fuller,4,"Great location for exploring as staff were really helpful. The breakfast was brilliant.
The rooms are good and functional - no complaints",https://lh3.googleusercontent.com/a-/ALV-UjUx8qWo0CVtNHxLkh6mkJ7_pPApELozcsAg0JLtgJsY6WB0HtxFvg=s128-c0x00000000-cc-rp-mo-ba5
54219791-6e69-48d5-ac61-037c05b49604,ChIJw2hhVWpbFkcRdriBTOnivEc,Hotel Kazimierz I,1186,4.4,Joan,2,"We stayed in the anex, which only had rooms there. The room was small on the 3rd floor with no lift. Breakfast was next door in a very nice area and lovely food. Here they had toilets and a lift. Very clean. Nice people.  Another downfall was the seating area if you didn't want to go back to the room, one settee, and one chair at the reception desk. We didn't feel comfortable there, so I booked a room at the hotel m29",https://lh3.googleusercontent.com/a/ACg8ocJMOVaonrtWo8q14OR3SqAPfMDPzWk2LaMyIOIAFDSxXXdh_Q=s128-c0x00000000-cc-rp-mo-ba4
3295a782-a644-45d2-acb7-9f967d58bf9b,NA,NA,NA,NA,NA,NA,NA,NA
c35c100a-0067-49af-afaa-eca50299325f,ChIJc8-YLBBbFkcRFDjCQePtgwY,Flying Tiger Copenhagen,3716,4.5,Momentum,4,"Flying Tiger offers a originality and big selection of products for a reasonable price with playful designs. They will make you smile and bring and open up your fantasy as you were kid. :-) You will find here from practical products for your household to small funny gifts, accessories, logical games, office and party equipment, and many more. Be aware that sometimes the place gets too crowded.",https://lh3.googleusercontent.com/a-/ALV-UjWMYoAwuYmmgIJRDei-wdLvOqrEIXgHIbAh0eO36wEE_wlTMB5k=s128-c0x00000000-cc-rp-mo-ba4
c35c100a-0067-49af-afaa-eca50299325f,ChIJc8-YLBBbFkcRFDjCQePtgwY,Flying Tiger Copenhagen,3716,4.5,Illy B,5,Good shop! Was quite busy but that is to be expected. Go on a weekday if you want a quieter visit.,https://lh3.googleusercontent.com/a-/ALV-UjV80mV8AnyDryCjvYR2RaFCJfyEX41kaPTXP9Ju2bOUjkNcvqJw=s128-c0x00000000-cc-rp-mo-ba3
c35c100a-0067-49af-afaa-eca50299325f,ChIJc8-YLBBbFkcRFDjCQePtgwY,Flying Tiger Copenhagen,3716,4.5,Марія Писаренко,1,"Very rude staff. The store is open until 9:00 PM, but at 8:50 PM they’re already yelling at you and rudely saying the store is closed and you have to leave. Either don’t advertise that the store is open until 9:00 PM or talk to your staff.",https://lh3.googleusercontent.com/a/ACg8ocJ8TSbIGPS9SCKE2mVFGMGS4S8Jk7NoyMmPbX7p0Xtvv6TmFQ=s128-c0x00000000-cc-rp-mo
c35c100a-0067-49af-afaa-eca50299325f,ChIJc8-YLBBbFkcRFDjCQePtgwY,Flying Tiger Copenhagen,3716,4.5,Mark Goldberg,5,"Flying Tiger is truly the best! They have everything you can dream of. I got a nice notebook and some pens and was very pleased with the price and quality. From visiting one, I started visiting all of the other Flying Tigers that I would come across.

They’re a great spot to pop in to see if they have whatever you need. I would definitely recommend checking it out!",https://lh3.googleusercontent.com/a/ACg8ocK6TIIQDDZFzV3f1wTIl3syKFM2y8BKcvtqf9wys-I07ejHyJ8=s128-c0x00000000-cc-rp-mo-ba5
c35c100a-0067-49af-afaa-eca50299325f,ChIJc8-YLBBbFkcRFDjCQePtgwY,Flying Tiger Copenhagen,3716,4.5,nikita jagita,5,"Pretty good, well organized and great service. A young man who works here is very sweet :) reccomend!!!",https://lh3.googleusercontent.com/a-/ALV-UjWtHjxJvYbx0-0WTF4vwOvfAUPPfMA-RVtaEZNTRtMGctJ5NVtW=s128-c0x00000000-cc-rp-mo-ba3
e7651e84-f6e8-4844-927e-9ca5a76195e4,NA,NA,NA,NA,NA,NA,NA,NA
1d685e4d-5562-4561-b068-b63947c13cba,ChIJd-1W52pbFkcRIgggxbybXBk,Podbrzezie 5,NA,NA,NA,NA,NA,NA
2f3c8e76-325c-4d77-b18d-150e2b409a5a,ChIJ9U2ASqFbFkcRRmy1Y4UtlRw,NA,NA,NA,NA,NA,NA,NA
4a001c02-ad1e-44fe-b57b-2064b5bf2851,ChIJQ2-pmApbFkcRTymMcVJ1YAQ,DS i Hotel Żaczek,991,3.8,O Sz,1,"Room handed over very dirty, no signs of cleaning at all especially the entire bathroom. Low standard interior/lighting, constant bad smell from the drain or sewage in bathroom, no basic appliances provided like fridge, kettle etc. Admin didn’t bother to listen to or fix anything.",https://lh3.googleusercontent.com/a/ACg8ocLGtIHZmrFViG5yWNNJab4LIjjdvJBQQ1YOgPAI5wLdVOr69g=s128-c0x00000000-cc-rp-mo-ba3
4a001c02-ad1e-44fe-b57b-2064b5bf2851,ChIJQ2-pmApbFkcRTymMcVJ1YAQ,DS i Hotel Żaczek,991,3.8,D G,5,Student's Hotel just few meters from CDProject RED office in Krakow - wich is enought reason to be perfect place to stay.,https://lh3.googleusercontent.com/a-/ALV-UjXsDHT8SMISCkGHdI8gyx1ldp1nNIbXjF0ABnFA__LWt7Gj1Lfc=s128-c0x00000000-cc-rp-mo-ba4
4a001c02-ad1e-44fe-b57b-2064b5bf2851,ChIJQ2-pmApbFkcRTymMcVJ1YAQ,DS i Hotel Żaczek,991,3.8,Roxana Ion,1,"If you have the rooms near the bar (like we had) it's going to be noisy! Because in every evening is a party in the garden, cause the club is an independent business and they can do what they want inside a hotel! 🙄
The carpet is so dirty that after 5 minutes in the room, the soles turn black. The pillows smells bad.
The people from the reception are nice, though.",https://lh3.googleusercontent.com/a-/ALV-UjXy8Q4zuMAavvTuSvZ4rWEL_AWjJxTbF4SgVlX3NsdbB5Jv2j1-zw=s128-c0x00000000-cc-rp-mo
4a001c02-ad1e-44fe-b57b-2064b5bf2851,ChIJQ2-pmApbFkcRTymMcVJ1YAQ,DS i Hotel Żaczek,991,3.8,Bálint Zákányi,5,"We stayed there for a school trip.
The rooms were really clean and comfortable, the breakfast were delicious.",https://lh3.googleusercontent.com/a-/ALV-UjVtgvmtTPlqgWy74WWqpxL4mkhJiYWhK_BOo28RIScdiWtFeK4=s128-c0x00000000-cc-rp-mo
4a001c02-ad1e-44fe-b57b-2064b5bf2851,ChIJQ2-pmApbFkcRTymMcVJ1YAQ,DS i Hotel Żaczek,991,3.8,Ethan Jenkinson,4,"The “hotel” is really just you renting a room in a student residence, although the room was very clean, quiet, and comfortable. The location allows you to get to the old city and tourist attractions within ten minutes and parking is free. The only downsides are staff have almost no English skills and the inside of the dormitory is a maze, it is very hard to get to and find your room. For the price though I can’t complain. Definitely would recommend for budget-minded travellers visiting Kraków.",https://lh3.googleusercontent.com/a/ACg8ocICy1NHb4Mo39t-9AFety0xLJ1dJoNDVU7AdZagiTy7ZwhVrA=s128-c0x00000000-cc-rp-mo-ba3
9f9956a6-3c53-49fa-8c5b-cc861f8d4269,ChIJYzI7fW9YFkcRju9j0TtYf7U,Lastrada Catering Sp. z o.o.,93,5,Barbara Kudanowska,5,"We had a big event this week and worked with Lastrada Catering in Krakow for the first time. It was great. The food was very tasty, beautifully presented, the co-operation was very good and reliable. We were delighted and can recommend the company 100%.
We would choose them again! Thank you very much for the great cooperation!!!!",https://lh3.googleusercontent.com/a/ACg8ocKmYmstighmFLWXPBI8IrdSBhgnC-5WTg-OShyvH8QQBOPtOw=s128-c0x00000000-cc-rp-mo
9f9956a6-3c53-49fa-8c5b-cc861f8d4269,ChIJYzI7fW9YFkcRju9j0TtYf7U,Lastrada Catering Sp. z o.o.,93,5,Viki Liptáková,5,"I just wanted to thank you and your team for providing us with an amazing Christmas dinner. Everything was set up beautifully and tasted really great!
Thank you again and I hope we will be able to use your service in the close future again :).",https://lh3.googleusercontent.com/a/ACg8ocJmRh3NHNkCBdD-wa4EYu29M2kEVLTgJhZhmvcnbrP1aKnklQ=s128-c0x00000000-cc-rp-mo
9f9956a6-3c53-49fa-8c5b-cc861f8d4269,ChIJYzI7fW9YFkcRju9j0TtYf7U,Lastrada Catering Sp. z o.o.,93,5,Marcin Pajak,5,"Encouraged by a friend, I chose Catering Lastrada to organize a company picnic...
And it was a hit!!!
Super professional service, great food, clean and elegant equipment.

I heartily recommend it!
Additionally, a great Manager - Marianna :)",https://lh3.googleusercontent.com/a/ACg8ocLPh27rBtcamLR9P_k35b5HdLwhh6Ml_NRLnL-yddHnRz76bg=s128-c0x00000000-cc-rp-mo
9f9956a6-3c53-49fa-8c5b-cc861f8d4269,ChIJYzI7fW9YFkcRju9j0TtYf7U,Lastrada Catering Sp. z o.o.,93,5,Room Outlet,5,"We highly recommend the catering service from LaStrada to anyone who wants to organize a buffet that not only looks beautiful but also one from which guests are happy to help themselves and after trying one thing they want to try everything as soon as possible! We couldn't have chosen a better choice - we didn't choose the menu, we relied entirely on the selection of LaStrada employees - during the three-day event, each day we received a different, well-composed and surprising set of delicacies (both meat and vegetarian ones received a lot of praise). A huge advantage is trouble-free communication and extremely punctual deliveries and pickups, which allowed us to focus on our guests. I recommend it for larger celebrations and corporate events!",https://lh3.googleusercontent.com/a/ACg8ocLUQ1tRskpwsz_I-vWXXKBFC9Zhm2-WDSreE4AyCMraj0kFcQ=s128-c0x00000000-cc-rp-mo
9f9956a6-3c53-49fa-8c5b-cc861f8d4269,ChIJYzI7fW9YFkcRju9j0TtYf7U,Lastrada Catering Sp. z o.o.,93,5,Mariola GNC,5,Recommended! Very tasty and beautifully presented food. And the cakes are a thing - especially the cheesecake with peaches :),https://lh3.googleusercontent.com/a-/ALV-UjV7LBrgCZLKgV0clGbKffTUtyeilh_ENshKMfyqlL5OO5WfJP4=s128-c0x00000000-cc-rp-mo
ac62ad77-0d61-4cd0-9617-68c4879ce30d,ChIJz_jNaAlbFkcRgbsHfl3W3Ag,Grand Ascot Hotel,878,4.7,Caroline,5,"Wonderful stay at the Grand Ascot Hotel. Room was spotless, staff were lovely and its a great surrounding area. Close to food venues and not far frm shops. Ideal for a short break in Krakow!",https://lh3.googleusercontent.com/a-/ALV-UjWy9zU7eE0EvFM0WtwY-l16JGDTLw6xPMBtsjMKxEyBVz4dp4nG=s128-c0x00000000-cc-rp-mo-ba5
ac62ad77-0d61-4cd0-9617-68c4879ce30d,ChIJz_jNaAlbFkcRgbsHfl3W3Ag,Grand Ascot Hotel,878,4.7,Stavroula Grigoriou,5,"The Grand Ascot hotel in Krakow is an amazing hotel just few minutes away from the old square of Krakow. Our twin room was exceptional, the biggest room I've ever had in Europe, very clean, with an enormous bathroom and great facilities. Our breakfast was included in room's price.  It was quality and enough to start our day. My only comment concerns the soft mattress. I'd prefer one with better support at the edge of the bed. The staff is friendly and they met all our requirements. Thank you for our stay!!!",https://lh3.googleusercontent.com/a-/ALV-UjW6rTABAOHWS-ap3avK0G9YL19RNQVbsmvKR4Xd9dy_rNEaWXLWPw=s128-c0x00000000-cc-rp-mo-ba3
ac62ad77-0d61-4cd0-9617-68c4879ce30d,ChIJz_jNaAlbFkcRgbsHfl3W3Ag,Grand Ascot Hotel,878,4.7,Julie Livesey,5,"Amazing stay ❤️
Firstly we would like to thank all your staff for our fantastic stay at your beautiful hotel.
Secondly we would like to thank you from the bottom of our heart for everything you did for us after we stupidly left our belongings in the safe.
You responded to our phone call impeccably in getting our belongings sent via taxi to the airport.
You went above and beyond our expectations and we will never forget this.
The hotel is spotlessly clean, rooms cleaned every day and beds changed every day.
The hotel is in a fantastic location close to everything.
Breakfast in the hotel is lovely and something for everyone
Thank you Grand Ascot you are the best 🥰
Kindest regards
Mr & Mrs Livesey Room 101",https://lh3.googleusercontent.com/a/ACg8ocL0gg56PVsc9CS4cnGVWQu9mOOSnZQqitRLBtzIDmAPUP0yJQ=s128-c0x00000000-cc-rp-mo
ac62ad77-0d61-4cd0-9617-68c4879ce30d,ChIJz_jNaAlbFkcRgbsHfl3W3Ag,Grand Ascot Hotel,878,4.7,Sandra Sirrell,5,"Loved this hotel, everything was perfect. Great location, fabulous room, lovely staff and great breakfast. Couldn't fault anything and would recommend.",https://lh3.googleusercontent.com/a/ACg8ocJ8xm1c6YVOHKqKa1166HIMf9p-Ee42D4c27MyaNcZj6hBFww=s128-c0x00000000-cc-rp-mo
ac62ad77-0d61-4cd0-9617-68c4879ce30d,ChIJz_jNaAlbFkcRgbsHfl3W3Ag,Grand Ascot Hotel,878,4.7,Iván Colón,3,"We stayed at a two twin room with our infant son. The hotel provided us with a wooden crib which was greatly appreciated. The staff is not very friendly and most of the time won’t even greet you when you enter the hotel. One positive aspect of the hotel is the location which is very close to downtown. Also, there are many restaurants nearby.",https://lh3.googleusercontent.com/a/ACg8ocJXBmGMaKozJeP71ZxztaUBzBESNW-6D54Xwg8V0zaO4r9ZmA=s128-c0x00000000-cc-rp-mo
432fbc1c-5ceb-403b-a59b-a3f0ee303803,ChIJJy3q49HlU0cREw06QNfCQKE,Eg,2,5,Sebastian Düpre,5,"Great quality and amazing owner.
I highly recommend IT 🔥",https://lh3.googleusercontent.com/a/ACg8ocJXL5hYCFpbuD4IOpLDDD55ryogzeBhsfxbgoYkG98sR4LyrA=s128-c0x00000000-cc-rp-mo
432fbc1c-5ceb-403b-a59b-a3f0ee303803,ChIJJy3q49HlU0cREw06QNfCQKE,Eg,2,5,Martyna Pietrzyk,5,,https://lh3.googleusercontent.com/a/ACg8ocI3mlFIAstuPSy2nQ-ACFL-c15IDaDJL8N0Da__QWKDsKWfkQ=s128-c0x00000000-cc-rp-mo
f1fe765a-9f09-410b-8194-257dc87c72c7,NA,NA,NA,NA,NA,NA,NA,NA
