id_gov,id_google,name,user_ratings_total,rating,reviews.author_name,reviews.rating,reviews.text,reviews.profile_photo_url
35e16511-5f32-4bb1-aec8-f5f7ecc11fdc,ChIJBd8bWt5bFkcR8vOyNnlAfKY,Basen Daisy,43,3.5,Mikhail Balyasny,3,quite good hotel. small rooms but good price and very silent place,https://lh3.googleusercontent.com/a/ACg8ocLpoPdS8JhI2XiOZLUNIyngvM6TKnXUOlXZ-RJ1N9BEdhfj-Q=s128-c0x00000000-cc-rp-mo
35e16511-5f32-4bb1-aec8-f5f7ecc11fdc,ChIJBd8bWt5bFkcR8vOyNnlAfKY,Basen Daisy,43,3.5,Dariusz Włodarczyk,5,Ok,https://lh3.googleusercontent.com/a-/ALV-UjUP9QnJxTgpOvKI-s6Qe1kjiiugVVp8cLGV8O84QmiqH5Ii1REZ=s128-c0x00000000-cc-rp-mo-ba5
35e16511-5f32-4bb1-aec8-f5f7ecc11fdc,ChIJBd8bWt5bFkcR8vOyNnlAfKY,Basen Daisy,43,3.5,Jola Straż,4,"Nice small swimming pool. You can swim casually. Very accessible, no wild crowds. I am very satisfied.",https://lh3.googleusercontent.com/a/ACg8ocJzj1QVxrw9K1Dx90zH7poysw2lRRdxT7JGihFKt3yrmgB00A=s128-c0x00000000-cc-rp-mo
35e16511-5f32-4bb1-aec8-f5f7ecc11fdc,ChIJBd8bWt5bFkcR8vOyNnlAfKY,Basen Daisy,43,3.5,Dawid Andrzej,1,I have never encountered such unprofessional and uncommunicative service. Sanitary conditions around the swimming pool are terrible and disgusting. I advise you to avoid this place,https://lh3.googleusercontent.com/a/ACg8ocLOJtYn-V0jmdq-IOu2SIPoOr986VLOHvmQM4vNl72ZGNfMVw=s128-c0x00000000-cc-rp-mo
e281170e-82e7-4cf8-bfe0-9a356c79952f,NA,NA,NA,NA,NA,NA,NA,NA
a856867c-7874-49d1-8d17-62cb19ddf256,ChIJZcmIz_ZaFkcRBN89reFVQnw,Dworek Golden Horn,466,4.6,Cihan Kahraman,4,We stayed at the hotel on New Year's Eve and everything was great. The staff was constantly asking if we needed anything. The breakfast was good. The only problem was that the location was a bit far from the center.,https://lh3.googleusercontent.com/a-/ALV-UjXdBItzHIaXENc2Jcd7FNP0XFBDiYaqDlcxju5t4Q2MBYa39DR33w=s128-c0x00000000-cc-rp-mo
a856867c-7874-49d1-8d17-62cb19ddf256,ChIJZcmIz_ZaFkcRBN89reFVQnw,Dworek Golden Horn,466,4.6,DeeSeaBee,5,"I was there this week with friends and
Family. It was a sad occasion because we had just buried a very special family member at the cemetery in Krakow. I was
Very sad. Yet the staff working there at this hotel was very sweet and professional. They brought light into my life at this difficult time. For a few minutes an Angel appeared and happiness descended upon me. Just for a few minutes. This i believe was meant to be. The rooms were clean and the food was outstanding. Thank you for your hospitality. I will never forget this hotel and the staff working there. I pray I will be there again and to experience that same happiness soon. David Bolen.",https://lh3.googleusercontent.com/a-/ALV-UjWIbk71mUasghyKnuBGocXNcW5pQBXhhxEvsYZLPdE2VLe2_Sw=s128-c0x00000000-cc-rp-mo
a856867c-7874-49d1-8d17-62cb19ddf256,ChIJZcmIz_ZaFkcRBN89reFVQnw,Dworek Golden Horn,466,4.6,Eva Durr,5,"We loved this hotel!
Beautiful, elegant, clean rooms, bathroom. Really high quality.
The breakfast was marvellous.
Pani Agnieszka was very helpful. We'll return.",https://lh3.googleusercontent.com/a-/ALV-UjXoiqGCEcQ3wC1vOSE-xEKC26eWGdB43leTcnaE8hLBJJo2y37Ffg=s128-c0x00000000-cc-rp-mo-ba3
a856867c-7874-49d1-8d17-62cb19ddf256,ChIJZcmIz_ZaFkcRBN89reFVQnw,Dworek Golden Horn,466,4.6,Tatiana Latiakova,5,"A nice small hotel located in a peaceful environment close to the city center. Rooms are clean, beds comfortable and food is very tasty. I really enjoyed my stay here.",https://lh3.googleusercontent.com/a/ACg8ocJuat4LB5mc2R2PXhG92xPWlvj_DIr-UCjV2b7uze6_rSY3Nw=s128-c0x00000000-cc-rp-mo
a856867c-7874-49d1-8d17-62cb19ddf256,ChIJZcmIz_ZaFkcRBN89reFVQnw,Dworek Golden Horn,466,4.6,Anna Tarapygina,5,10 mins by cab ftom the center. Rooms are clean and comfortable. Staff is always helpful,https://lh3.googleusercontent.com/a-/ALV-UjVExft6m3S7T-crii3IJKOmVtHROQ8bslbO2vLldt3PsGbSsB8=s128-c0x00000000-cc-rp-mo
ff82596a-87f4-470f-8302-29f2d6a66a99,NA,NA,NA,NA,NA,NA,NA,NA
c3b372b0-54d0-407b-9c56-01424263890c,ChIJD9z0-AhbFkcR0oU597Bxfo0,Karmelicka 36,NA,NA,NA,NA,NA,NA
ec0e9c34-054f-46d2-b369-bfdfde20d1cd,ChIJWYydYSlbFkcRgBCekD_ZFiI,Hampton by Hilton Krakow,2697,4.5,Edward Wright,5,"We stayed one night. The location is good. There is a Doubltree next door and the hotel’s own parking is there. If you park behind the Hampton, make sure you pay through Apcoa as that place does not belong to the hotel!

The staff was VERY nice and helpful, the service was outstanding! I messed up the booking and booked a twin, totally my fault and they helped me and swapped to a double!

The rooms are nice, the bed was comfortable and the shower was great.

Breakfast is amazing, with so many local and international options.
They also have a restaurant with a limited menu for dinner, also very nice!

I can only recommend and will stay again!",https://lh3.googleusercontent.com/a-/ALV-UjUKpmGx6PhYFpv58apJyPFTvKyu60vWz1t7TLak8DYyfkDgDNd-hQ=s128-c0x00000000-cc-rp-mo-ba6
ec0e9c34-054f-46d2-b369-bfdfde20d1cd,ChIJWYydYSlbFkcRgBCekD_ZFiI,Hampton by Hilton Krakow,2697,4.5,Andrew Koehler,5,"Very impressive.  Clean, modern, nice breakfast, attentive staff.
I personally think it is the perfect location: close to a park and trams.  Plus as a Diamond member I have access to the amazing gym and facilities in the Doubletree.
Enjoying my stay!",https://lh3.googleusercontent.com/a-/ALV-UjUO6O_S3_kT-8jZSJ5--PqxrKcPGBksjqLJj2kqAk-pVGTNN63mAw=s128-c0x00000000-cc-rp-mo-ba3
ec0e9c34-054f-46d2-b369-bfdfde20d1cd,ChIJWYydYSlbFkcRgBCekD_ZFiI,Hampton by Hilton Krakow,2697,4.5,Pliekhov Maksym,1,"Think twice (or maybe twenty times) before booking a stay at this hotel. At first glance, it seems like a great place—part of a renowned chain, relatively new, with spacious rooms, a comfy bed, a shower cabin, and decent breakfast options. But what you don’t know is what awaits you at night.

Some rooms in this hotel face an inner courtyard, which is completely enclosed by the facades of four buildings. Inside this courtyard are the air conditioning units. If you're lucky enough (like I was) to get a room facing this courtyard, brace yourself for a night straight out of a horror movie. The steady humming of several air conditioning units creates a maddening resonance. And when the night falls and everything else is quiet, that sound will haunt you everywhere.

At around 2 a.m., when you’re on the verge of losing your sanity, the only thing that might save you is a pair of noise-canceling headphones with music playing—because those subtle vibrations even reach your pillow. But after a few hours, the battery of your headphones will die, and trust me, the living will envy the dead.

The hotel reception is fully aware of this nightmare and greets you with a devilish smile when you show up at 2 a.m., saying, ""Haha, no other rooms available.""

Highly recommended for those looking to test their mental endurance. For everyone else, my advice is simple: RUN...",https://lh3.googleusercontent.com/a/ACg8ocI4glJaNtLBuQxVgPo3SLBXmgoBUYK-EiWM-dBhn-eWNpYGpw=s128-c0x00000000-cc-rp-mo
ec0e9c34-054f-46d2-b369-bfdfde20d1cd,ChIJWYydYSlbFkcRgBCekD_ZFiI,Hampton by Hilton Krakow,2697,4.5,Jeff Lam,5,"Excellent Hampton quality. Clean and good service with a delicious buffet breakfast. Gym equipment was in good condition too.

Warning, the pool and jacuzzi gets busy and I saw many people lining up and waiting long time to get in.",https://lh3.googleusercontent.com/a-/ALV-UjWz97NYQeZLskTwlo_YOtdeyXdPWQ5X2U6gXouWZHZCVqokKRUHuA=s128-c0x00000000-cc-rp-mo-ba6
ec0e9c34-054f-46d2-b369-bfdfde20d1cd,ChIJWYydYSlbFkcRgBCekD_ZFiI,Hampton by Hilton Krakow,2697,4.5,Murat Gedik,5,"Dear Sara,

I had the pleasure of staying at your hotel from November 22 to 24, and I wanted to take a moment to thank you from the bottom of my heart. Your kindness and attention before my trip truly made a difference, and thanks to you and your amazing team, I am leaving Krakow with wonderful memories of an unforgettable journey.

I deeply appreciate everything you’ve done, and I look forward to the day our paths cross again.

With heartfelt gratitude,",https://lh3.googleusercontent.com/a-/ALV-UjU-4hJHuaIUlU5_EaZEKj2-6JB93U1PnUG8v9gneo6EEAWDcl_B=s128-c0x00000000-cc-rp-mo-ba3
703d0021-4f5d-4e22-95e8-3759fc19665f,ChIJS6HXCAJdFkcRDRchNkD94-U,Boisko do tenisa,NA,NA,NA,NA,NA,NA
a74ec5a4-85c6-4bf4-b50e-d1210884aca7,ChIJfRMPI3NbFkcR1RBcu4eaxQE,Hotel 32 Kraków Old Town,565,4.7,lyssa,5,"Great location, clean rooms and friendly staff. We always came back to our room lovely and clean, with clothes nicely folded if they were previously on the bed, which was a polite touch. Also great value! We were on the 4th floor and loved the view from the windows. Will definitely be back if we’re in Krakow again!",https://lh3.googleusercontent.com/a-/ALV-UjVD1tu-PTNu-w8rxSu9c1wB8v5YU4uE__EHwhzN66SRcBIYPco=s128-c0x00000000-cc-rp-mo
a74ec5a4-85c6-4bf4-b50e-d1210884aca7,ChIJfRMPI3NbFkcR1RBcu4eaxQE,Hotel 32 Kraków Old Town,565,4.7,Ewan Macaulay,5,Not much to look at from the outside and the reception area does not fill you with joy but room was excellent. Good size room with comfortable bed with plenty of pillows. Great wardrobe space. Split-cycle a/c in room so you have excellent control of room temperature. Good breakfast. Easy walking distance of tourist attractions and conference centre.,https://lh3.googleusercontent.com/a/ACg8ocJ0uEDkqIUWtER2iDEE9oc1SJqjjBBbwO0YjrP_xTpcl6tFoQ=s128-c0x00000000-cc-rp-mo-ba2
a74ec5a4-85c6-4bf4-b50e-d1210884aca7,ChIJfRMPI3NbFkcR1RBcu4eaxQE,Hotel 32 Kraków Old Town,565,4.7,David Thowsen,5,"Great and affordable hotel just a few minutes walk from Stare Miasto. Clean and spacious room, nice beds and nice bathroom. Since the restaurant was closed, we got vouchers for breakfast right across the street. Service minded staff. We will stay here next time we visit Krakow also.",https://lh3.googleusercontent.com/a-/ALV-UjWQQakXo3HPnz5LBiU3egqqyZwdFZqrFYvDEzJm1Gri5d5ydU3N=s128-c0x00000000-cc-rp-mo-ba2
a74ec5a4-85c6-4bf4-b50e-d1210884aca7,ChIJfRMPI3NbFkcR1RBcu4eaxQE,Hotel 32 Kraków Old Town,565,4.7,Kerry Davies,5,"Checked out this morning and already planning next trip back.
Rooms have everything you need and are comfortable. Enjoyed the selection of foods at breakfast.
Staff couldn’t be more helpful. The location is really convenient to access the local tourist hotspots.  The only improvement would be if there was a communal area for drinks but it won’t stop me from returning.",https://lh3.googleusercontent.com/a/ACg8ocJUQPIykoD7e91wIVyLA2i9K472XKQ-hj_A4TVfk9KSTNONIg=s128-c0x00000000-cc-rp-mo
a74ec5a4-85c6-4bf4-b50e-d1210884aca7,ChIJfRMPI3NbFkcR1RBcu4eaxQE,Hotel 32 Kraków Old Town,565,4.7,Marielle Nielsen,1,It seemed like a great hotel but when we found silverfish in the bathroom the hotel staff didn’t do anything. It was very gross and silverfish is an invasive species which can follow you home. I think it was very unprofessional of them to not do or say anything about the issue.,https://lh3.googleusercontent.com/a/ACg8ocLuVOpFWnLvw2mAzNJYo-W_R-KQqdG1lhLuLiIu3cwuEb4DLw=s128-c0x00000000-cc-rp-mo
9fd48a7b-0b5f-4c8b-994f-3793cb39e8db,NA,NA,NA,NA,NA,NA,NA,NA
3a0e5044-bbde-429d-881a-10498de08760,NA,NA,NA,NA,NA,NA,NA,NA
6a531011-b153-4f8e-97d5-88afcad79115,ChIJDxv2Kw9bFkcRB3mWX5iGBZ4,FOREST HOTEL,393,4.5,Andrew Koehler,5,"I was super impressed with this place.
First of all its right in the middle of the forest so it's very convenient to start hikes or trail rides directly from the parking lot.
The room was really big and the industrial stone walls were cool, plus the windows to the forest.
The sauna was a great surprise.  Staff was very helpful.
Lastly, the Castle is about 200 meters away so you can stroll down there for dinner.  Really loved this place.",https://lh3.googleusercontent.com/a-/ALV-UjUO6O_S3_kT-8jZSJ5--PqxrKcPGBksjqLJj2kqAk-pVGTNN63mAw=s128-c0x00000000-cc-rp-mo-ba3
6a531011-b153-4f8e-97d5-88afcad79115,ChIJDxv2Kw9bFkcRB3mWX5iGBZ4,FOREST HOTEL,393,4.5,Vica C.,5,"Truly one of the BEST hotel stays in Europe we've experienced after many trips.
The location is beautiful, in the woods surrounded by nature, and next door to another large hotel with a restaurant. The restaurant is delicious as well, with great service. It overlooks the city below and I recommend it. The hotel is also located close enough to he city where ubers are convenient, fast, and cheap. Perfect location. We can't express how pleasantly surprised we were by the breakfast as well! So worth the cost. No doubt.
The staff we talked with all spoke English, which we were grateful for.
We were grateful too that our room was available early. The view of the woods, room, bathroom, and hotel were fabulous. Modern and clean and tidy. The saunas and salty iodine spa
made this hotel enen MORE enjoyable. All of our requests and questions were always met with a smile and graciousness. We would love to and plan to stay here again, hopefully longer!",https://lh3.googleusercontent.com/a-/ALV-UjVM2eJB4OpZYjKJvyooQPiyIWn28TGtBSSJumWHh4qBT3EaqKoqRQ=s128-c0x00000000-cc-rp-mo-ba4
6a531011-b153-4f8e-97d5-88afcad79115,ChIJDxv2Kw9bFkcRB3mWX5iGBZ4,FOREST HOTEL,393,4.5,Andrew Dawson (Dawsmonkee),5,"What a beautiful hotel! It looks a bit strange on the outside, but once you’re inside, that’s what matters. The area is peaceful and quiet, the rooms are spacious, clean and comfortable. The facilities are great, we used the sauna for an hour, included in the price. We hiked around the forest, we also saw some mountain bike paths that look a lot of fun!",https://lh3.googleusercontent.com/a-/ALV-UjWH9iwRd8mWkLzV4njZxDY_P3LjCG2ZOUEKlYU8m0MGjoaeeA3pOQ=s128-c0x00000000-cc-rp-mo-ba6
6a531011-b153-4f8e-97d5-88afcad79115,ChIJDxv2Kw9bFkcRB3mWX5iGBZ4,FOREST HOTEL,393,4.5,Yana Sokhta,5,Excellent location with forest  view. Parking available. Friendly staff. Beautiful and cozy room. Great place ❤️,https://lh3.googleusercontent.com/a-/ALV-UjUMDByzQn0syYf4OgLBN26UyatfqZxESNoz54Ai7Vr8SOLyX2Nu=s128-c0x00000000-cc-rp-mo
6a531011-b153-4f8e-97d5-88afcad79115,ChIJDxv2Kw9bFkcRB3mWX5iGBZ4,FOREST HOTEL,393,4.5,B K,3,"We did not have a great time there. The reception was not so attentive and we did not get welcome package which was promised to us by hotel itself. The room was Ok with double bed composed of 2 single beds. I believe that the price was not worth the experience.
Probably never gonna book there.",https://lh3.googleusercontent.com/a-/ALV-UjU7MrgTtp0sKySPLHFElkVZ0tzXM3f9oM1EePArE6cskfwnE2s=s128-c0x00000000-cc-rp-mo-ba4
c751dda1-1c92-4126-8a24-15a786b9ab5d,ChIJZQKyExNbFkcReFhI2othVLo,Royal Casino,22,4.8,wdl wdq,5,Adam is Lovely to meet st the door. He is also very service oriented. Wiktoria id a Lucky bird for some people at the table but not me today…,https://lh3.googleusercontent.com/a/ACg8ocIQYW-2jSlEbJytGwNNBzZI3JDyUTZk5Wp9rC8touyl-BeDTg=s128-c0x00000000-cc-rp-mo
c751dda1-1c92-4126-8a24-15a786b9ab5d,ChIJZQKyExNbFkcReFhI2othVLo,Royal Casino,22,4.8,Emilian Vama,5,Very gentle staff and nice atmosphere,https://lh3.googleusercontent.com/a-/ALV-UjWF6UU_hC0pYdX8txTSZoMdNENmmefRc_lIlNt_ghD2wVYx-5Lc=s128-c0x00000000-cc-rp-mo
c751dda1-1c92-4126-8a24-15a786b9ab5d,ChIJZQKyExNbFkcReFhI2othVLo,Royal Casino,22,4.8,Mossey,5,Best place ever,https://lh3.googleusercontent.com/a/ACg8ocIPs7wszaxkkUVmbtGUFNs_AcNkOshK3upzz2gAwV2J40PzpQ=s128-c0x00000000-cc-rp-mo
c751dda1-1c92-4126-8a24-15a786b9ab5d,ChIJZQKyExNbFkcReFhI2othVLo,Royal Casino,22,4.8,Norbiaszek *,5,"High-level service, Mr. Adam, the receptionist, has an incredible sense of humor, can answer every question and has an incredibly high level of personal culture. Despite its recent opening, the place can surprise you with its availability and variety of machines. I highly recommend it.",https://lh3.googleusercontent.com/a-/ALV-UjVUzvn7CW-BSKKIIUVFgkIAWJILwHJAGtu0eyCl4T235NIVG1hgIQ=s128-c0x00000000-cc-rp-mo
c751dda1-1c92-4126-8a24-15a786b9ab5d,ChIJZQKyExNbFkcReFhI2othVLo,Royal Casino,22,4.8,Maciej Maciej,5,"Very good and nice service, Mr. Adam took care of us like in the Sheraton hotel",https://lh3.googleusercontent.com/a-/ALV-UjX3awYCOpvZ_ddolcDe40UNBApxy3co-u7zo5UbZ6y19imy1pNk=s128-c0x00000000-cc-rp-mo-ba3
c1116620-cd64-47e0-bdec-e1145390ef7c,ChIJHxD6Ep9dFkcRJfzFR3mN8IQ,NA,NA,NA,NA,NA,NA,NA
3fc7d99c-24c2-447e-8c2a-02cfb66f0bf5,ChIJaQG71WxbFkcRqn55XunpCQ4,BALTHAZAR DESIGN HOTEL,238,4.8,Christos Papagrigoriou,5,One thing. The best hotel I have ever stayed at. Excellent service across all departments top hygiene and quality of every amenity provided to me and my mom. Staff takes an 11/10 for always taking the extra mile. To me this hotel is the only choice if you visit krakow as both the restaurant and the location is IDEAL.,https://lh3.googleusercontent.com/a/ACg8ocKJCeSnKBejoFgWdWE1CR1ukGG9_81PoAESLGT8agOVRw3Ekw=s128-c0x00000000-cc-rp-mo
3fc7d99c-24c2-447e-8c2a-02cfb66f0bf5,ChIJaQG71WxbFkcRqn55XunpCQ4,BALTHAZAR DESIGN HOTEL,238,4.8,Cloe Turnner,5,"Fantastic stay here! Not only is the location perfect, but the hotel, staff, rooms, breakfast and service was amazing! They really couldn't do enough for you - certainly try the adjoining restaurant. Absolute 5 star stay. Thanks again - you were all great!",https://lh3.googleusercontent.com/a/ACg8ocJrohS89KhsbF1LauyV0OdadG7svf0tsLFGFQv8AH4LXHusnA=s128-c0x00000000-cc-rp-mo
3fc7d99c-24c2-447e-8c2a-02cfb66f0bf5,ChIJaQG71WxbFkcRqn55XunpCQ4,BALTHAZAR DESIGN HOTEL,238,4.8,Moonlight Sonata (Teal Muah),5,"The hotel boasts exquisitely appointed rooms featuring luxurious amenities and exceptionally comfortable bedding.  The on-site restaurant offers a spectacular dining experience, complemented by an extensive wine list and signature cocktails.",https://lh3.googleusercontent.com/a-/ALV-UjWSg0I_RdGh8YB3Mw6qOWpJAFWWthcCyVB23zMj8N8IEQAyGMCDdA=s128-c0x00000000-cc-rp-mo-ba5
3fc7d99c-24c2-447e-8c2a-02cfb66f0bf5,ChIJaQG71WxbFkcRqn55XunpCQ4,BALTHAZAR DESIGN HOTEL,238,4.8,Cindy Mielke,2,"The hotel was great in every aspect except for one thing. My shopping bag with all the purchases I made on my 10 day trip disappeared from our room. They offered me a good deal for my next visit, but I will never be back. They offered to go through the CCTV footage, of course they found nothing, and said they trust their staff. So sorry, can't help you. Well that's all fine and dandy, but my items didn't evaporate into thin air. Someone took them from my room. Be careful if you stay here. That's all.",https://lh3.googleusercontent.com/a-/ALV-UjUFyrOs3Ejhq27qJPwMawljhOEUBoYSl4tFYFbDpdEP8GWo2I0qJg=s128-c0x00000000-cc-rp-mo
3fc7d99c-24c2-447e-8c2a-02cfb66f0bf5,ChIJaQG71WxbFkcRqn55XunpCQ4,BALTHAZAR DESIGN HOTEL,238,4.8,Miguel Ruiz,5,"A wonderful luxury boutique hotel right at the heart of everything. Large comfortable room with sitting, sleeping, and working areas, and bathroom the size of a smaller hotel room. The service was exquisite, including the glasses of Amaretto as a welcome treat. We did not try the on-site restaurant, but other guests highly recommended it. The price was reasonable for a luxury hotel, yet lower than most global luxury chains. I will be back next time I visit Krakow, and highly recommend it to anyone.",https://lh3.googleusercontent.com/a/ACg8ocJJjzbUsuUfGuOLPhD2OaaPpLkqGO9Kvl7N3lTHK0StGpWX2Q=s128-c0x00000000-cc-rp-mo-ba4
86abd0af-dd77-48ee-8b41-cd3e3699c9c1,NA,NA,NA,NA,NA,NA,NA,NA
1a95b08b-de3e-42c2-bab6-7f3171f208e0,ChIJPTUJgiRFFkcRIrAUet32fv0,PHgraf Piotr Halo,NA,NA,NA,NA,NA,NA
1cfcf693-7078-41f5-bf8d-a4b827cf5ba6,NA,NA,NA,NA,NA,NA,NA,NA
f1ca1cfd-7b35-4bc4-82bb-2f3ed7fa7ba1,ChIJqSClN3ZbFkcRDP6cpgfXltg,Flisacka 3,NA,NA,NA,NA,NA,NA
269e7502-cd9a-456e-a3b4-4ff637cd69a3,NA,NA,NA,NA,NA,NA,NA,NA
5ca9c902-d4f9-497d-94cf-8571cf6b8dc9,NA,NA,NA,NA,NA,NA,NA,NA
8fdf4d17-ed9b-4281-b3fd-41ba95d1a021,NA,NA,NA,NA,NA,NA,NA,NA
8a362ef4-6a13-4aad-9b3d-575d17adbea6,ChIJ7ZP2WHNbFkcRzFfHh-LSNX8,Wygoda 8A,NA,NA,NA,NA,NA,NA
dfeca467-fafc-4688-80b7-b8fae888d92c,NA,NA,NA,NA,NA,NA,NA,NA
df2bb203-fdc0-4459-afb0-e2f313ed01de,NA,NA,NA,NA,NA,NA,NA,NA
0bea6783-791c-41fa-8a3c-def09a8ce4f6,ChIJ8dCYnBBbFkcRXGCUyEgu3WU,Lubicz 4,NA,NA,NA,NA,NA,NA
f39b4b8c-84df-4289-8f1d-24c79684f4e2,ChIJaxVF6rZEFkcR_Cz827G7f78,Saska 2C,NA,NA,NA,NA,NA,NA
0771df0d-b197-4682-be7c-57e018db7f50,NA,NA,NA,NA,NA,NA,NA,NA
55f3f3c4-dfce-4e7a-a00d-002149e4a0ed,ChIJGyP8ogVbFkcRNNIlYLoVaec,Santi. Kosmetyki,NA,NA,NA,NA,NA,NA
ceb00d8d-0344-42a9-b726-78c0758f6176,ChIJoZJXPxFbFkcRnrrNSvBIVHk,Hotel Maximum,342,4.4,Sylwia Bogacka,3,"Perfect location close to train station and Old town. Solid breakfast , nothing fancy but plenty of choice.

Due to old building and high ceilings, room was very cold. Radiators were off... to keep warm AC needed to work on full heat blast. Also quite loud in the night as tram track right text to the building and some pipe noises in the night.",https://lh3.googleusercontent.com/a/ACg8ocKlZ8fom9xhMrv680P_9MWYq8y5BOwOvbagCc-mNnef0a5eSA=s128-c0x00000000-cc-rp-mo-ba2
ceb00d8d-0344-42a9-b726-78c0758f6176,ChIJoZJXPxFbFkcRnrrNSvBIVHk,Hotel Maximum,342,4.4,Niels Klompen,4,"A very nice hotel. Rooms are very clean and nice. Beds a bid on the small size for personal prefferances ... but okay. If booking, i'd suggest to ask for a room on the rear of the hotel. The tram rails can be noisy. Breakfast is over complete and very good.
All in all I would recommend this hotel.",https://lh3.googleusercontent.com/a-/ALV-UjXRYx2SaxUuqKgpMPtomlUWWMxO8n0WULl3HRheskFLiMwdeMP-=s128-c0x00000000-cc-rp-mo-ba3
ceb00d8d-0344-42a9-b726-78c0758f6176,ChIJoZJXPxFbFkcRnrrNSvBIVHk,Hotel Maximum,342,4.4,Andrew Michael Dishington,1,"Just had the worst experience with a staff member when we had breakfast. Some young girl with the worst attitude. We couldn’t work out the coffee machine because it was in polish and there was an option to set to English, so we did. Then she storms out changes it back right in front of us before we even had the chance to use it and all she said to us was Polish and walks off. If this type of behaviour happened in Australia she would have been sacked on the spot. But we’re not in Australia and this has left a bad taste in my mouth about customer service in Poland and this hotel. I worked in hospitality before and this type of behaviour is not acceptable. Clearly she has no idea about customer service and belongs out the back and not dealing with the public.",https://lh3.googleusercontent.com/a-/ALV-UjUAhWKz7qZWftDiBnlPyVhljQWlFwWzCfSZoZ_7Y5S0UmhL_Lg=s128-c0x00000000-cc-rp-mo-ba2
ceb00d8d-0344-42a9-b726-78c0758f6176,ChIJoZJXPxFbFkcRnrrNSvBIVHk,Hotel Maximum,342,4.4,Michael Farmer,5,"Located a short stroll from the main square, so convenient, but the trams… if you’re unlucky enough to get a room at the front be ready for a disturbed night. They seem to rattle past every 5-10 minutes for most of the night and again from early in the morning. Breakfast was good and the room was clean.",https://lh3.googleusercontent.com/a-/ALV-UjXd6Cw2DUkz4-j7jOYOq4If1rErrxVn9ZBO_CcZqsOD1qQofJw=s128-c0x00000000-cc-rp-mo
ceb00d8d-0344-42a9-b726-78c0758f6176,ChIJoZJXPxFbFkcRnrrNSvBIVHk,Hotel Maximum,342,4.4,Amelia Nowak,1,"Very bad place to sleep. There was a party near our room whole night, we couldn't sleep at all, karaoke next room and very very laud noises ! Not recommended !",https://lh3.googleusercontent.com/a-/ALV-UjXbEQXPldeSvxr_X9xFCjlXYssjsEaU1_QFoSx_W4miF99-i7MI=s128-c0x00000000-cc-rp-mo
365d4943-e3da-463e-94fa-0b38927e3575,NA,NA,NA,NA,NA,NA,NA,NA
92479c67-347d-42ca-99b8-2c401773dfc4,ChIJ59dNJxBbFkcR1ltwaIsVyUY,Pijarska 17 Restaurant,289,4.2,Ivan Popov,5,"Beautiful place with great service. Waiter advised wine that suited or dishes very well.
I live in Krakow for more than seven years now, and this is one of the most delicious polish dishes I ate here. 5/5",https://lh3.googleusercontent.com/a-/ALV-UjXrN1JQrtZ8tQxMdTo40PJ_huckiGRv2b7AU02gY7dGtJB6LhfJJQ=s128-c0x00000000-cc-rp-mo-ba4
92479c67-347d-42ca-99b8-2c401773dfc4,ChIJ59dNJxBbFkcR1ltwaIsVyUY,Pijarska 17 Restaurant,289,4.2,Anastasiya Lobachov,5,"Excellent food, excellent service! We came to celebrate a 50 year anniversary and every thing was on top! Izaak, our waiter was so great, he even managed to calm our 4 year old which was crying all the way to the restaurant. The starters, the soups and the meat - all delisios !!! Definitely will came back on our next trip!",https://lh3.googleusercontent.com/a/ACg8ocI_ocXMdUkR1jB4qeMZJGNQYLHyA5Fq02dkn6Wi1-Wc_d6dRzkz=s128-c0x00000000-cc-rp-mo
92479c67-347d-42ca-99b8-2c401773dfc4,ChIJ59dNJxBbFkcR1ltwaIsVyUY,Pijarska 17 Restaurant,289,4.2,Anita Riddeough,5,"Had lunch twice and fabulous both times. Lovely friendly waiters. Food
Amazing and reasonably priced. Can recommend",https://lh3.googleusercontent.com/a/ACg8ocIBs8goYkdv8LT5GaUnu-eVVgpTypjsCpqu6cH4uWgZ1DlDww=s128-c0x00000000-cc-rp-mo
92479c67-347d-42ca-99b8-2c401773dfc4,ChIJ59dNJxBbFkcR1ltwaIsVyUY,Pijarska 17 Restaurant,289,4.2,Maria G.,5,"Very good food, ate here several times and all 5 of us enjoyed our meals. Friendly and child friendly waiters. Nice restaurant.",https://lh3.googleusercontent.com/a-/ALV-UjXZr4bx5nOw4jUUhrerPZLnpHZvqun-3BYsPjPdckalQ60AIWZ75A=s128-c0x00000000-cc-rp-mo-ba4
92479c67-347d-42ca-99b8-2c401773dfc4,ChIJ59dNJxBbFkcR1ltwaIsVyUY,Pijarska 17 Restaurant,289,4.2,ira burchak,5,"Lovely atmosphere, polite staff, tasty food!",https://lh3.googleusercontent.com/a-/ALV-UjXAlwYDkh9Jwng3pcPwYmnXpp5NbfTm9jFSWyDYnjzSqmzp8Yxu_A=s128-c0x00000000-cc-rp-mo-ba3
c937cd6b-9323-4435-9d3d-303f49f8b206,NA,NA,NA,NA,NA,NA,NA,NA
b86742f9-ccbb-4316-b52e-5424c21bd53c,ChIJwyHWcRJbFkcRt9iyH2pwlJQ,NA,NA,NA,NA,NA,NA,NA
